{
  "fixture_id": "F2",
  "run_id": "F2-A",
  "input_hash": "d9b4632b54bbd83589ee3a80b73a95ddcb264d3c425dbacb82a67ca94b435eb8",
  "skill_hash": "8f2bedc424d626d7e2c7ea16e27410b4d41802895933afb0ed64de66f26a7fbc",
  "execution": {
    "date": "2026-10-29（香港时间）",
    "context": "独立盲评的干净任务上下文；仅使用指定冻结技能、评分与购买规则、本题原始输入及结果schema，未读取oracle、tests/README、其他fixture或结果、父对话或历史；未联网。",
    "configuration": "继承默认配置且无模型覆盖；精确后端模型及推理配置未暴露，记为未知。",
    "observed_scope": "仅F2虚构材料评分，运行F2-A；安全与交易事实均是题设，不属于现实商品或现实标准核验。"
  },
  "anchors": {
    "declaration": "先固定七项权重35/20/15/10/10/5/5及下列共同尺度，再逐款计分；缺证不填中位分，不把资料量计入表现。",
    "quality": {
      "weight": 35,
      "indicators": "同版防泼水、拉链循环、缝线抗拉表现及厚度标示一致性；安全另设门槛。",
      "0": "核心防泼水或拉链、缝线出现有据的严重失效，明显不适合通勤。",
      "5": "基本使用性能可用，但性能稳定性或标示一致性存在实质取舍。",
      "10": "标示一致，并有充分可比依据证明核心性能与持续耐久显著优越。",
      "intermediate_rule": "相同的防泼水通过、10000次拉链无失效及100N缝线结果，且标签一致，支持8分基线；没有持续使用及显著性能优势依据，不升10。厚度在10件及复测中持续短少25%属于系统性标示不符，扣2分，功能仍通过使其不降至严重失效档。"
    },
    "fit": {
      "weight": 20,
      "indicators": "A4容纳、轻量通勤适配及既定使用边界，不把同一耐久测试重复奖励。",
      "0": "不能装A4或已证实与日常通勤用途明显冲突。",
      "5": "能够装载，但有会明显影响通勤的体积、重量或操作取舍。",
      "10": "明确满足用途且有充分比较依据证明显著便利优势。",
      "intermediate_rule": "已确认A4和轻量通勤适配、没有关键未知，记8分；没有额外便利优势依据，不将两款推至10分。"
    },
    "value": {
      "weight": 15,
      "indicators": "公开同版价加必要费用相对于80测试元预算及已核功能，不把优惠或服务负面再扣一次。",
      "0": "有据证明支出相对于实际可用功能严重不合理。",
      "5": "基本功能满足，但成本接近预算且没有明显经济余量。",
      "10": "同等可用功能下有充分可比依据证明显著价格优势及很低的必要支出。",
      "intermediate_rule": "同效用公开总支出明显低于预算，可评8分；相差3测试元不构成显著价值档位差，两款同为8分，不声称全市场最低。"
    },
    "long_term_cost": {
      "weight": 10,
      "0": "有据的频繁更换或必要费用造成严重长期负担。",
      "5": "持有成本可评且处于可接受水平，但有明显费用取舍。",
      "10": "同使用周期、功能与维护口径下，有据证明长期总成本显著更低。",
      "scope": "现有材料不足以估计完整持有期和更换负担，整体N/A；不以购入价或拉链循环测试代替。"
    },
    "after_sales": {
      "weight": 10,
      "indicators": "7日未使用退货、12个月质量保修的覆盖和可归属执行结果。",
      "0": "有据证明服务基本不可用，且严重违约没有可行补救。",
      "5": "存在基本承诺，但实际执行有重要障碍或未解决的违约。",
      "10": "承诺充分，且足够多样、持续的可归属执行结果证明服务显著可靠。",
      "intermediate_rule": "上述明示承诺与当前服务渠道构成7分覆盖基线；5份按期履约记录提升至8分，但小样本不支持10。完整证据证明无约定理由拒绝符合条件的退货且未退款，扣3分至4，因其直接破坏用户重视的可行救济，影响大于未见功能失效的厚度标示事件；不推断普遍拒退。"
    },
    "rd_marketing": {
      "weight": 5,
      "0": "有据的严重独立误导行为或研发宣传完全失实。",
      "5": "可归属成果与宣传兑现仅基本成立且有重要取舍。",
      "10": "有充分可比依据证明研发成果显著有效、宣传真实兑现。",
      "scope": "企业成果证据不足为N/A；厚度同一标签事件已经归质量，没有独立营销误导，不重复扣。"
    },
    "labor": {
      "weight": 5,
      "0": "可归属主体存在严重、未补救的劳动待遇负面。",
      "5": "实际工时、报酬与补救基本可评，仍有重要取舍。",
      "10": "有充分实际执行与可比证据证明劳动待遇显著良好。",
      "scope": "缺少实际劳工材料为N/A，不以未发现争议加分。"
    },
    "safety_and_status": "题设T-边缘防护及T-接触材料逐项通过；80测试元硬预算独立审查。已核售后违约属于选择取舍，未被题设设为自动排除条件；不把已知服务差等同安全未通过。"
  },
  "candidates": [
    {
      "candidate_id": "F2-A",
      "product_version": "袋甲防泼水2026",
      "dimensions": {
        "quality": {"score": 6, "weight": 35, "evidence_ids": ["F2-A-1"], "reason": "共同功能测试支持8分基线，但10件及复测均指向厚度比标示少25%，按标示一致性扣2分至6。功能通过仍有效，不推断其抗拉弱于乙。", "evidence_state": "同版独立检测及标签对照；试验范围可评，长期实用表现未知"},
        "fit": {"score": 8, "weight": 20, "evidence_ids": ["F2-COMMON-1"], "reason": "A4与轻量通勤适配均已确认，达到8分档；未证明显著额外便利，不升至10。", "evidence_state": "独立同版验收支持适配；非配置推断耐久"},
        "value": {"score": 8, "weight": 15, "evidence_ids": ["F2-A-2", "F2-A-1", "F2-B-2"], "reason": "49+0=49测试元，占预算61.25%，已核功能下有明显预算余量；比乙便宜3元不足以形成整档价值差，不再重复扣质量或售后。", "evidence_state": "当前公开价及零配送费；未领券、未复现结算"},
        "long_term_cost": {"score": null, "weight": 10, "evidence_ids": ["F2-COMMON-2"], "reason": "完整持有期、必要维护与更换成本缺少可评依据，N/A；购入价和循环测试不填补此项。", "evidence_state": "资料不足，非已核负面"},
        "after_sales": {"score": 4, "weight": 10, "evidence_ids": ["F2-A-2", "F2-A-3"], "reason": "明示服务覆盖基线7分，符合条件的退货遭无约定理由拒绝且尚未退款，扣3分至4。单一完整事件足以削弱执行可信度，不能外推所有订单。", "evidence_state": "可归属订单与完整沟通证明实际违约；平台补救待定"},
        "rd_marketing": {"score": null, "weight": 5, "evidence_ids": ["F2-A-1", "F2-COMMON-2"], "reason": "企业成果材料不足，整体N/A；没有区别于厚度标签的独立营销误导，不另扣营销。", "evidence_state": "资料不足；同事件去重"},
        "labor": {"score": null, "weight": 5, "evidence_ids": ["F2-COMMON-2"], "reason": "没有足以判断实际劳工状况的材料，N/A；不把无资料或未见争议当表现差或好。", "evidence_state": "资料不足，非已核负面"}
      },
      "safety": [
        {"item": "T-边缘防护", "state": "通过", "evidence_ids": ["F2-COMMON-1"], "reason": "题设同版验收及归属、签发均已核实；仅为虚构条件。"},
        {"item": "T-接触材料", "state": "通过", "evidence_ids": ["F2-COMMON-1"], "reason": "题设确认本题相关材料安全要求满足，厚度标示不符未被证明是安全失败。"}
      ],
      "purchase_status": "可进入购买决策",
      "status_reason": "版本、用途、安全、49元含必要费用、现货及市场M配送条件均已明确；已知拒退是扣分后的重要取舍，不是未知安全门槛或题设硬排除条件。仅在接受服务执行风险时考虑，不能把页面承诺当可靠履约保证。",
      "negative_events": [
        {"event_id": "E-厚度", "evidence_ids": ["F2-A-1", "F2-COMMON-2"], "primary_dimension": "quality", "before": 8, "after": 6, "reason": "重复样本的25%厚度短少支持扣2分，加权影响35×(6−8)/10=−7分；实际防泼水及耐拉指标通过，不附加虚构性能或安全损失。", "other_consequences": ["没有独立成立的另一营销误导事件，研发营销不重复扣分。", "评论只转述同一事件，不增加发生次数或另设口碑扣分。"]},
        {"event_id": "E-退货", "evidence_ids": ["F2-A-3", "F2-A-2", "F2-COMMON-2"], "primary_dimension": "after_sales", "before": 7, "after": 4, "reason": "独立订单的条件内退货被拒且无退款，直接妨碍用户重视的救济，扣3分；加权影响10×(4−7)/10=−3分，不能推断普遍拒退或保修也必然失败。", "other_consequences": ["与检测样品及消费者不同，属于独立事件，可与厚度事件分别计分。", "平台处理结果待定；接受该风险才保留为购买候选，退款或制度补救证据可改变售后判断。", "未证明其他独立损失，质量、价值、营销与口碑不再重复扣。"]}
      ],
      "aggregate": {"kind": "partial", "numerator": 53, "denominator": 80, "included_dimensions": ["quality", "fit", "value", "after_sales"], "formula": "35×6/10+20×8/10+15×8/10+10×4/10=21+16+12+4=53/80；扣前局部基线63/80，厚度−7、退货−3；不折算100分，不称综合分。"}
    },
    {
      "candidate_id": "F2-B",
      "product_version": "袋乙防泼水2026",
      "dimensions": {
        "quality": {"score": 8, "weight": 35, "evidence_ids": ["F2-B-1"], "reason": "功能测试达到统一8分基线，厚度标示与10件实测一致；尚无持续使用或显著性能优势依据，不升10。", "evidence_state": "标签与同版独立检测；与甲相同工况可比"},
        "fit": {"score": 8, "weight": 20, "evidence_ids": ["F2-COMMON-1"], "reason": "A4与轻量通勤适配均已确认，达到8分档；相同宽度不创造相对便利优势。", "evidence_state": "同版独立验收支持适配"},
        "value": {"score": 8, "weight": 15, "evidence_ids": ["F2-B-2", "F2-B-1", "F2-A-2"], "reason": "52+0=52测试元，占预算65%，同效用下仍有明显预算余量；比甲多3元只是小额取舍，不为重复奖励售后提高价值分。", "evidence_state": "当前公开价及零配送费；非已复现结算价"},
        "long_term_cost": {"score": null, "weight": 10, "evidence_ids": ["F2-COMMON-2"], "reason": "完整持有期与更换成本不可评，N/A；不以初始52元或循环测试外推终身费用。", "evidence_state": "资料不足，非已核负面"},
        "after_sales": {"score": 8, "weight": 10, "evidence_ids": ["F2-B-2"], "reason": "相同7分承诺覆盖基线上，5份完整订单按期履约支持提升1分至8；样本小且不能证明长期保修全部兑现，不给10。", "evidence_state": "可归属的实际服务执行小样本"},
        "rd_marketing": {"score": null, "weight": 5, "evidence_ids": ["F2-COMMON-2"], "reason": "没有足以判断企业研发成果及整体营销兑现的材料，N/A；标签一致已归质量，不重复奖励营销。", "evidence_state": "整体资料不足，保留已核标签局部结果"},
        "labor": {"score": null, "weight": 5, "evidence_ids": ["F2-COMMON-2"], "reason": "实际工时、待遇与补救资料不足，N/A；不从未发现负面推定劳工更好。", "evidence_state": "资料不足，非已核负面"}
      },
      "safety": [
        {"item": "T-边缘防护", "state": "通过", "evidence_ids": ["F2-COMMON-1"], "reason": "题设同版验收及归属、签发均已核实；仅为虚构条件。"},
        {"item": "T-接触材料", "state": "通过", "evidence_ids": ["F2-COMMON-1"], "reason": "题设确认全部相关材料安全条件满足，无决定性安全缺口。"}
      ],
      "purchase_status": "可进入购买决策",
      "status_reason": "用途、安全、预算、现货、必要费用与市场M配送已有足够依据，且有实际服务履约样本；52元仍是公开价，最终库存及结算可能变化。",
      "negative_events": [],
      "aggregate": {"kind": "partial", "numerator": 64, "denominator": 80, "included_dimensions": ["quality", "fit", "value", "after_sales"], "formula": "35×8/10+20×8/10+15×8/10+10×8/10=28+16+12+8=64/80；不折算100分，不称综合分。"}
    }
  ],
  "comparison": {
    "order_type": "comparable_subset",
    "candidate_order": ["F2-B", "F2-A"],
    "reason": "仅在质量、适配、公开价格价值和售后这四项同口径80权重中，乙64/80高于甲53/80；实际性能没有已核差异，乙的优势来自标示一致及有据的履约表现。用户重视服务执行时优先乙；甲便宜3元，只有接受已知标示与服务取舍时才考虑，不据此声称乙的未知长期成本或企业维度也优胜。",
    "unresolved": ["两款长期持有成本、企业研发营销与实际劳工状况均N/A，不能排名完整综合表现。", "甲平台补救尚待定；出现实际退款及可归属补救证据后须重评售后，但不自动消除历史拒退事实。", "交易证据时间为2026-10-28，实际执行日期为2026-10-29；本次遵题设固定证据未联网刷新，公开价未升级为已复现结算价。"]
  }
}
