{
  "fixture_id": "F2",
  "run_id": "F2-B",
  "input_hash": "d9b4632b54bbd83589ee3a80b73a95ddcb264d3c425dbacb82a67ca94b435eb8",
  "skill_hash": "e5cc1f9a5a61b93c025ff8d8109cd3747031695061e89de762146820cd4d7662",
  "execution": {
    "date": "2026-10-30（Asia/Hong_Kong）",
    "context": "独立新上下文；仅使用本题固定原始材料、共享评分口径和允许规则，未读取其他题目、结果或oracle。",
    "configuration": "继承默认配置，无显式模型覆盖；精确后端和采样参数未知。",
    "observed_scope": "仅观察F2固定虚构材料及共享口径；未联网、未验证客户端触发或现实商品。",
    "calibration_hash": "ed172ab85e0d5c4ed4e3a12a21c091199069b0a21e530059b6773f2a67b8841c"
  },
  "anchors": {
    "basis": "先按F2原始需求及r2共享口径锁定尺度，再独立归属事件与计算；权重35/20/15/10/10/5/5，未知不补分。",
    "quality": {"scope": "同版防泼水、拉链10000次、缝线承力及标签实测一致性", "0": "核心通勤功能严重失效", "5": "基本可用但功能稳定或真实性有重要取舍", "8": "所给性能充分支持目标且标示一致，无显著超额表现依据", "10": "需可比实证证明显著耐久或一致性优势", "adjustment": "相对已核功能基础，复测一致的25%厚度标示差异下调2分；不虚构功能下降或重复扣营销。"},
    "fit": {"scope": "A4容纳及轻量通勤尺寸、操作便利", "0": "无法装A4或通勤用途不成立", "5": "能装但携带或操作有明显负担", "8": "A4与轻量通勤充分适配，无关键未知或额外便利差异", "10": "需可比的显著额外便利"},
    "value": {"scope": "题设当期同版公开价加已知必要费用，相对80测试元预算和已核基本功能", "0": "必要支出明显不匹配效用或不能满足预算", "5": "预算占用90%至100%", "7": "预算占用大于80%小于90%", "8": "预算占用60%至80%，含端点", "9": "预算占用低于60%，限定报价范围内余量明显", "10": "需同功能同交易层次充分可比证据证明突出优势", "boundary": "小额价差同档保留原金额；未结算不称确定到手价或最低价。"},
    "long_term_cost": {"scope": "完整持有期后续支出", "na": "材料不足则N/A；开合测试不推寿命或更换费用"},
    "after_sales": {"scope": "7日未使用退货、12个月质量保修条款及可归属退换执行", "0": "基本救济实际不可获得且无有效路径", "5": "基本服务存在但有重要履约取舍", "7": "明确条款基准，有限执行不足以证明优胜", "8": "条款基准加符合条件订单按期退换的有限样本", "10": "需比有限样本更强且有实益的持续服务、保修及维修表现", "adjustment": "符合条件却无约定理由拒绝且未退款，从7分下调3；直接阻断已到期救济，对本题取舍的作用大于厚度真实性扣分。"},
    "rd_marketing": {"scope": "企业研发成果及独立营销事实", "na": "整体依据不足则N/A；厚度事件不重复扣分"},
    "labor": {"scope": "实际工时、待遇与补救", "na": "材料不足则N/A"},
    "gates": "安全、预算80、A4及通勤核心目标独立判断；已知非门槛缺点进入分数和条件建议，附加未知不自动降级。",
    "aggregation": "仅同项目同权重可比；各项按权重×分数÷10加总，保留原权重分母，不归一化。"
  },
  "candidates": [
    {
      "candidate_id": "F2-A",
      "dimensions": {
        "quality": {"score": 6, "weight": 35, "evidence_ids": ["F2-A-1"], "reason": "防泼水、10000次开合及100N缝线支持8分基础；0.8mm标示与0.6mm复测均值相差25%，按口径扣2至6，不推断功能下降。", "evidence_state": "同版独立检测与复测；真实性负面已证实"},
        "fit": {"score": 8, "weight": 20, "evidence_ids": ["F2-COMMON-1"], "reason": "A4容纳和轻量通勤适配已核，无关键未知或显著额外便利。", "evidence_state": "同版独立样品验收"},
        "value": {"score": 8, "weight": 15, "evidence_ids": ["F2-A-1", "F2-A-2"], "reason": "公开价49加配送0，占80预算61.25%，基本功能成立，落60%至80%的8分档；未领取优惠或结算。", "evidence_state": "题设当期同版公开价；非结算价或市场最低"},
        "long_term_cost": {"score": null, "weight": 10, "evidence_ids": ["F2-COMMON-2"], "reason": "完整持有成本依据不足，不能把10000次开合当寿命或更换费用。", "evidence_state": "资料不足，N/A"},
        "after_sales": {"score": 4, "weight": 10, "evidence_ids": ["F2-A-2", "F2-A-3"], "reason": "明确条款基准7分；符合条件的第3天未使用退货被无约定理由拒绝且未退款，扣3至4。平台处理仍待定，不外推所有订单或保修执行。", "evidence_state": "公开条款及可归属完整订单、沟通记录"},
        "rd_marketing": {"score": null, "weight": 5, "evidence_ids": ["F2-A-1", "F2-COMMON-2"], "reason": "研发及独立营销依据不足；厚度事件已归质量，无另行查实的营销误导，不重复扣分。", "evidence_state": "整体依据不足，N/A"},
        "labor": {"score": null, "weight": 5, "evidence_ids": ["F2-COMMON-2"], "reason": "没有足以判断实际劳工状况的资料。", "evidence_state": "资料不足，N/A"}
      },
      "safety": [
        {"item": "T-边缘防护", "state": "通过", "evidence_ids": ["F2-COMMON-1"], "reason": "题设核实同版全部相关边缘防护条件及归属签发，仅限虚构通勤用途。"},
        {"item": "T-接触材料", "state": "通过", "evidence_ids": ["F2-COMMON-1"], "reason": "题设核实同版接触材料条件；不扩展至浸水、防护或医疗用途。"}
      ],
      "purchase_status": "可进入购买决策",
      "status_reason": "袋甲防泼水2026的版本、A4通勤功能、安全、49+0≤80、现货及市场M全境配送明确（F2-COMMON-1、F2-A-1、F2-A-2）。标示不符与已核拒退为非门槛缺点，需接受这些取舍；公开价尚非结算价，未用优惠不计入。",
      "negative_events": [
        {"event_id": "E-厚度", "evidence_ids": ["F2-A-1", "F2-COMMON-2"], "primary_dimension": "quality", "before": 8, "after": 6, "reason": "10件均值和复测均为0.6mm，相对0.8mm标示少25%；扣2对应加权减少7分，不把真实性差异写成已核功能下降。评论仅转述，不新建事件。", "other_consequences": []},
        {"event_id": "E-退货", "evidence_ids": ["F2-A-3", "F2-COMMON-2"], "primary_dimension": "after_sales", "before": 7, "after": 4, "reason": "订单与厚度样品、消费者独立，符合退货条件却无约定理由被拒且未退款；扣3对应加权减少3分，因直接阻断用户重视的救济，扣幅大于厚度。评论转述不重复计入。", "other_consequences": []}
      ],
      "aggregate": {"kind": "partial", "numerator": 53, "denominator": 80, "included_dimensions": ["quality", "fit", "value", "after_sales"], "formula": "35×6/10 + 20×8/10 + 15×8/10 + 10×4/10 = 21+16+12+4 = 53/80；分母35+20+15+10=80，不换算为/100。"}
    },
    {
      "candidate_id": "F2-B",
      "dimensions": {
        "quality": {"score": 8, "weight": 35, "evidence_ids": ["F2-B-1"], "reason": "标示与10件均值均0.6mm，防泼水、10000次开合及100N缝线支持本次目标；没有显著超额耐久依据。", "evidence_state": "标签及同版独立检测"},
        "fit": {"score": 8, "weight": 20, "evidence_ids": ["F2-COMMON-1"], "reason": "A4及轻量通勤适配已核，与袋甲无额外便利差异。", "evidence_state": "同版独立样品验收"},
        "value": {"score": 8, "weight": 15, "evidence_ids": ["F2-B-1", "F2-B-2"], "reason": "公开价52加配送0，占80预算65%，基本功能成立，同落8分档；比袋甲贵3测试元，同档不制造分差。", "evidence_state": "题设当期同版公开价；非结算价或市场最低"},
        "long_term_cost": {"score": null, "weight": 10, "evidence_ids": ["F2-COMMON-2"], "reason": "完整持有期支出不足以评价，开合试验不等于寿命。", "evidence_state": "资料不足，N/A"},
        "after_sales": {"score": 8, "weight": 10, "evidence_ids": ["F2-B-2"], "reason": "明确7日退货及12个月保修，5份可归属完整订单均按期完成符合条件退换，符合8分范围；小样本不保证未来或证明保修维修表现。", "evidence_state": "公开服务条款及有限完整执行样本"},
        "rd_marketing": {"score": null, "weight": 5, "evidence_ids": ["F2-COMMON-2"], "reason": "研发成果及整体营销依据不足；标签准确仅不扣质量，不再奖励营销。", "evidence_state": "资料不足，N/A"},
        "labor": {"score": null, "weight": 5, "evidence_ids": ["F2-COMMON-2"], "reason": "实际工时、待遇及补救没有足够资料。", "evidence_state": "资料不足，N/A"}
      },
      "safety": [
        {"item": "T-边缘防护", "state": "通过", "evidence_ids": ["F2-COMMON-1"], "reason": "题设核实同版相关边缘防护条件及归属签发，仅限虚构通勤用途。"},
        {"item": "T-接触材料", "state": "通过", "evidence_ids": ["F2-COMMON-1"], "reason": "题设核实同版接触材料条件；不外推至浸水、防护或医疗用途。"}
      ],
      "purchase_status": "可进入购买决策",
      "status_reason": "袋乙防泼水2026的核心功能、安全、A4及通勤适配、52+0≤80、现货、配送与售后条件已有足够依据（F2-COMMON-1、F2-B-1、F2-B-2）；未复现结算不机械降级，长期成本及企业附加未知保留。",
      "negative_events": [],
      "aggregate": {"kind": "partial", "numerator": 64, "denominator": 80, "included_dimensions": ["quality", "fit", "value", "after_sales"], "formula": "35×8/10 + 20×8/10 + 15×8/10 + 10×8/10 = 28+16+12+8 = 64/80；分母35+20+15+10=80，不换算为/100。"}
    }
  ],
  "comparison": {
    "order_type": "conditional",
    "candidate_order": ["F2-B", "F2-A"],
    "reason": "两款同项目同权重部分分可比，袋乙64/80、袋甲53/80。按本题重视实际售后执行且核心性能无差异的需求，优先袋乙：多3测试元换来一致标示和有限按期退换记录；袋甲仅在接受已核真实性、拒退取舍且更重视省3元时考虑，顺序不把部分分当综合最优。",
    "unresolved": ["两款完整长期持有成本、企业研发及实际劳工状况未知，不能作七项完整综合排名。", "袋甲拒退的平台处理和补救仍待定；袋乙退换样本小，两款12个月保修的实际执行范围未验证。", "报价及库存只对应题设2026-10-28固定材料；未复现结算、未核优惠，不能外推现实当前可购性。"]
  }
}
