{
  "fixture_id": "F4",
  "run_id": "F4-C",
  "input_hash": "ba47b1fa955ae16b4994a1561a09ae5d374b99e453ac0405866cc3a42dcfa298",
  "skill_hash": "8f2bedc424d626d7e2c7ea16e27410b4d41802895933afb0ed64de66f26a7fbc",
  "execution": {
    "date": "2026-10-29（Asia/Hong_Kong）",
    "context": "在单独新建的代理上下文内独立盲评；仅处理F4，不读取其他题、其他结果、oracle、tests/README或历史对话。",
    "configuration": "继承父代理默认配置，未指定模型或推理配置覆盖；实际后端标识未知。",
    "observed_scope": "仅使用冻结版购物技能及必要评分、购买、安全规则、F4固定虚构输入和结果schema；先加载think-like-me作为分析纪律。本次未联网、未实际检测或执行购买；材料日期沿用2026-10-28，不冒充2026-10-29重新核验。"
  },
  "anchors": {
    "declaration": "本轮在分项赋值和聚合前确定以下共同尺度；0/5/10描述表现，未知项用null，不把资料数量、完整报告公开程度或安全通过本身作为加分。中间分依已证实的实际收益和代价判断。",
    "weights": {"quality": 35, "fit": 20, "value": 15, "long_term_cost": 10, "after_sales": 10, "rd_marketing": 5, "labor": 5},
    "quality": {
      "scope": "产品实际工况稳定性、严重失效与可靠性；阅读够用和使用便利主要计适配。安全达标只作门槛，不奖励质量；实际反复发生的严重失效可归质量低分。",
      "0": "同版可复现的严重失效，正常应有的安全使用可靠性明显不能成立。",
      "5": "有足以评价工况稳定性的实际结果，基本可靠但有明确重要性能或耐久取舍。",
      "10": "代表性持续使用及耐久证据支持显著、可比的可靠性优势。",
      "na_rule": "只有正常亮度、便利及安全项目符合结果，仍不足以给总体质量可靠性分；保留局部事实。已证实严重失效足以判0，不需要虚构扣前基线。"
    },
    "fit": {
      "scope": "本题桌面阅读亮度与日常使用便利，安全和预算分别判断。",
      "0": "不能满足阅读亮度或无法完成本题桌面用途。",
      "5": "亮度基本够读，但使用便利有重要且已证实的负担。",
      "10": "充分同工况比较支持超出基本够用的显著阅读及操作收益。",
      "intermediate": "亮度和使用便利均明确满足需求但无显著超额优势，记8。"
    },
    "value": {
      "scope": "限定正常照明功能和已知同版交易条件下的公开报价价值，不将公开价称为结算价；安全状态独立优先。",
      "0": "没有能服务本题阅读用途的有效功能，公开费用也不形成有意义价值。",
      "5": "正常照明够用且必要费用合计达到100测试元预算上限。",
      "10": "正常照明与同等交易服务够用，公开费用合计不超过50测试元。",
      "intermediate": "本题同等正常功能和服务下，50至100测试元按5+(100-公开价及必要费用)/10取最近整数，最高10；这是公开报价的条件价值分，不是安全补偿。"
    },
    "long_term_cost": {
      "0": "有据的持有费用明显无法承受或持续使用成本严重失衡。",
      "5": "明确持有期内必要耗材、维修及电池成本可接受但有重要负担。",
      "10": "相同持有期与用途下，有证据支持显著较低总成本。",
      "na_rule": "不能用零配送费或低购买价补成长期持有成本。"
    },
    "after_sales": {
      "scope": "已取得的同版退货及质量保修条款可评；实际履行、维修配件能力尚无证据，不作推定。",
      "0": "已确认没有基本质量补救或承诺补救实际被严重拒绝。",
      "5": "提供7日未使用退货及12个月质量保修的基本条款保障。",
      "10": "基本条款外，便捷维修、配件保障及实际履约有可比证据支持显著优势。"
    },
    "rd_marketing": {
      "0": "已证实的重大宣传误导或成果失实。",
      "5": "可归属研发成果与主要宣传兑现达到基本水平。",
      "10": "可归属成果对本题产生显著实际收益，宣传与成果有充分可比依据。",
      "na_rule": "无足够成果、投入或宣传兑现材料时保留未知。"
    },
    "labor": {
      "0": "有可归属且严重、未补救的实际用工负面。",
      "5": "实际工时、待遇及补救等基本表现已有足够依据。",
      "10": "可归属实际工时、待遇、休假及补救持续显著优于基本水平。",
      "na_rule": "缺少实际用工资料不能填5，也不能当作无争议或福利优越。"
    },
    "safety_gate": "T-S1和T-S2均为虚构题设验收条件，且题设已确认覆盖本题全部关键要求；不引入现实法规或额外门槛。",
    "aggregation": "已评分项目按原权重×分项/10加总，只保留可评项目原权重分母，不归一化为100或10。行动状态优先于部分分。"
  },
  "candidates": [
    {
      "candidate_id": "F4-A",
      "version": "灯甲2026电池版",
      "dimensions": {
        "quality": {"score": null, "weight": 35, "evidence_ids": ["F4-A-1"], "reason": "已核正常使用事实和T-S2局部结果保留；尚不足以评价总体工况稳定性和可靠性，T-S1缺证本身不扣质量分。", "evidence_state": "局部实测可用，总体质量N/A；缺证不是缺陷"},
        "fit": {"score": 8, "weight": 20, "evidence_ids": ["F4-A-1"], "reason": "亮度与使用便利两项核心需求均满足，达到8分中间锚点；没有支持显著额外适配收益的比较结果。", "evidence_state": "可核归属的同版测试"},
        "value": {"score": 8, "weight": 15, "evidence_ids": ["F4-A-1", "F4-COMMON-1"], "reason": "同等正常照明和基本服务下，公开价69加已知运费0，按共同价值尺度8.1取8；仅评价这一报价条件，不确认结算价或安全通过。", "evidence_state": "具体同版商品页公开价及交易条件已取得，未复现结算"},
        "long_term_cost": {"score": null, "weight": 10, "evidence_ids": ["F4-COMMON-1"], "reason": "缺少持有期、电池、耗材及维修费用资料，无法把购入价延伸为长期成本。", "evidence_state": "资料不足，N/A"},
        "after_sales": {"score": 5, "weight": 10, "evidence_ids": ["F4-COMMON-1"], "reason": "7日未使用退货和12个月质量保修符合基本条款锚点；不推定已验证实际履行或配件能力。", "evidence_state": "同版售后条款已取得，实际执行与可维修性未核"},
        "rd_marketing": {"score": null, "weight": 5, "evidence_ids": ["F4-COMMON-1"], "reason": "没有足够可归属研发或营销兑现材料。", "evidence_state": "资料不足，N/A"},
        "labor": {"score": null, "weight": 5, "evidence_ids": ["F4-COMMON-1"], "reason": "没有足够实际用工材料，不能给中位或无负面奖励。", "evidence_state": "资料不足，N/A"}
      },
      "safety": [
        {"item": "T-S1：规定充电异常工况30分钟内电池表面≤60°C且无冒烟", "state": "待核", "evidence_ids": ["F4-A-1"], "reason": "缺少异常充电同版结果，且现有其他结果不能覆盖该工况；电池过热与起火风险对应的关键要求实质未明，不可由用户短时试用补证。"},
        {"item": "T-S2：规定正常使用工况无导电部件暴露", "state": "通过", "evidence_ids": ["F4-A-1"], "reason": "同版测试已核通过，保留规定正常使用工况的覆盖，不外推T-S1。"}
      ],
      "purchase_status": "仅适合优先核验",
      "status_reason": "版本、正常使用需求和69测试元公开费用及交易条件可确认，但T-S1为决定性关键安全缺口。须取得覆盖规定异常工况的同版可核结果，不能由便宜或T-S2通过替代。",
      "negative_events": [],
      "aggregate": {"kind": "partial", "numerator": 33, "denominator": 45, "included_dimensions": ["fit", "value", "after_sales"], "formula": "20×8/10＋15×8/10＋10×5/10＝16＋12＋5＝33/45；其余N/A保留原权重，不折算综合分。"}
    },
    {
      "candidate_id": "F4-B",
      "version": "灯乙2026电池版",
      "dimensions": {
        "quality": {"score": 0, "weight": 35, "evidence_ids": ["F4-B-1"], "reason": "异常充电发生高温并冒烟且同版复现，符合严重失效0分锚点；正常亮度满足不能抵消该失效。", "evidence_state": "可核归属的同版完整测试及一致复测"},
        "fit": {"score": 8, "weight": 20, "evidence_ids": ["F4-B-1"], "reason": "正常亮度和便利均满足，按与其他候选相同的适配尺度记8；安全不满足另行排除购买。", "evidence_state": "可核归属的同版测试，评分仅覆盖正常使用适配"},
        "value": {"score": 10, "weight": 15, "evidence_ids": ["F4-B-1", "F4-COMMON-1"], "reason": "在正常照明功能及相同服务这一限定比较中，公开费用49不超过50，符合10分锚点；该条件价值分不构成值得购买判断，安全失效优先排除。", "evidence_state": "具体同版商品页公开价及交易条件已取得，未复现结算"},
        "long_term_cost": {"score": null, "weight": 10, "evidence_ids": ["F4-COMMON-1"], "reason": "没有持有期及电池、耗材、维修费用依据。", "evidence_state": "资料不足，N/A"},
        "after_sales": {"score": 5, "weight": 10, "evidence_ids": ["F4-COMMON-1"], "reason": "同样的7日未使用退货和12个月质量保修仅支持基本条款5分，不足以说明安全失效已有补救。", "evidence_state": "售后条款已取得，实际执行与安全整改未核"},
        "rd_marketing": {"score": null, "weight": 5, "evidence_ids": ["F4-COMMON-1"], "reason": "没有足够研发或宣传兑现资料，不能把同一热失效再当作独立宣传负面扣分。", "evidence_state": "资料不足，N/A"},
        "labor": {"score": null, "weight": 5, "evidence_ids": ["F4-COMMON-1"], "reason": "没有足够实际用工资料。", "evidence_state": "资料不足，N/A"}
      },
      "safety": [
        {"item": "T-S1：规定充电异常工况30分钟内电池表面≤60°C且无冒烟", "state": "不满足", "evidence_ids": ["F4-B-1"], "reason": "第20分钟已达80°C并冒烟，同版复测一致；同时违反温度及无冒烟条件，有过热起火伤害路径，未见适用批次整改补救。"},
        {"item": "T-S2：规定正常使用工况无导电部件暴露", "state": "通过", "evidence_ids": ["F4-B-1"], "reason": "同版正常工况结果通过，只覆盖导电部件暴露项目，不能抵消T-S1失败。"}
      ],
      "purchase_status": "排除购买",
      "status_reason": "同版关键安全要求已证实不满足且复测一致，没有已核整改或适用批次补救；49测试元低价、正常亮度或部分分均不能改变排除状态。",
      "negative_events": [
        {"event_id": "F4-B-THERMAL-FAILURE", "evidence_ids": ["F4-B-1"], "primary_dimension": "quality", "before": null, "after": 0, "reason": "严重可复现的异常充电热失效使质量按0分锚点评价。扣分项成立，但缺少足够事故前整体质量基线，不能编造扣前分和定量扣幅；最终质量贡献为35×0/10＝0。", "other_consequences": ["T-S1不满足，直接排除购买。", "同一事件仅计入质量；不另扣安全分、口碑分、研发营销分或售后分。", "没有已核补救；若后续取得适用批次整改及规定工况验证结果，须重新核定，不由当前保修承诺代替。"]}
      ],
      "aggregate": {"kind": "partial", "numerator": 36, "denominator": 80, "included_dimensions": ["quality", "fit", "value", "after_sales"], "formula": "35×0/10＋20×8/10＋15×10/10＋10×5/10＝0＋16＋15＋5＝36/80；不与33/45或31.5/45直接比较，且不抵消排除购买。"}
    },
    {
      "candidate_id": "F4-C",
      "version": "灯丙2026电池版",
      "dimensions": {
        "quality": {"score": null, "weight": 35, "evidence_ids": ["F4-C-1"], "reason": "两项安全符合结果充分保留，完整报告未公开不扣分；但本题未给持续稳定性和耐久证据，总体质量可靠性仍不足评分，不能把安全通过当质量奖励。", "evidence_state": "验真同版结果页可用，总体可靠性N/A"},
        "fit": {"score": 8, "weight": 20, "evidence_ids": ["F4-C-1"], "reason": "亮度和便利均满足核心需求，按共同尺度记8；不因报告形式改变适配表现分。", "evidence_state": "同版正常亮度与便利结果已给定"},
        "value": {"score": 7, "weight": 15, "evidence_ids": ["F4-C-1", "F4-COMMON-1"], "reason": "正常照明与服务同等，公开费用79按共同尺度7.1取7；比甲多10测试元的成本取舍成立，但仍低于100预算。", "evidence_state": "具体同版商品页公开价及交易条件已取得，未复现结算"},
        "long_term_cost": {"score": null, "weight": 10, "evidence_ids": ["F4-COMMON-1"], "reason": "没有足够持有期、电池、耗材或维修费用资料。", "evidence_state": "资料不足，N/A"},
        "after_sales": {"score": 5, "weight": 10, "evidence_ids": ["F4-COMMON-1"], "reason": "7日未使用退货和12个月质量保修与其他候选一致，记基本条款5分；不外推实际维修和履约能力。", "evidence_state": "同版售后条款已取得，实际执行与可维修性未核"},
        "rd_marketing": {"score": null, "weight": 5, "evidence_ids": ["F4-COMMON-1"], "reason": "没有足够研发及宣传兑现材料；完整报告未公开不等于研发差或营销失实。", "evidence_state": "资料不足，N/A"},
        "labor": {"score": null, "weight": 5, "evidence_ids": ["F4-COMMON-1"], "reason": "没有足够可归属实际用工资料。", "evidence_state": "资料不足，N/A"}
      },
      "safety": [
        {"item": "T-S1：规定充电异常工况30分钟内电池表面≤60°C且无冒烟", "state": "通过", "evidence_ids": ["F4-C-1"], "reason": "验真后的同版结果页明确最高58°C且无冒烟，题设已核归属与工况足以覆盖要求；不因全文未公开而重置待核。"},
        {"item": "T-S2：规定正常使用工况无导电部件暴露", "state": "通过", "evidence_ids": ["F4-C-1"], "reason": "结果页已验真并确认规定工况无导电部件暴露，覆盖本题该项关键要求；不外推全部批次或现实商品。"}
      ],
      "purchase_status": "可进入购买决策",
      "status_reason": "准确版本、正常需求和两项全部关键安全条件有足够依据，79测试元公开价加必要配送费0低于100预算，指定卖家现货、全市场配送及售后条款已取得。未结算只限制价格称谓，不阻止按该公开条件进入购买决策。",
      "negative_events": [],
      "aggregate": {"kind": "partial", "numerator": 31.5, "denominator": 45, "included_dimensions": ["fit", "value", "after_sales"], "formula": "20×8/10＋15×7/10＋10×5/10＝16＋10.5＋5＝31.5/45；质量可靠性、长期成本及企业项N/A，不折算综合分。"}
    }
  ],
  "comparison": {
    "order_type": "conditional",
    "candidate_order": ["F4-C", "F4-A", "F4-B"],
    "reason": "这是行动状态顺序：丙可进入购买决策，甲仅优先核验T-S1，乙排除。甲与丙在相同适配、公开报价价值和售后条款项目上可作局部比较，甲部分分较高只来自10测试元价差；不能据此覆盖丙已经闭合的安全前提，也不能把乙的不同分母直接混排。",
    "unresolved": [
      "甲须取得覆盖T-S1规定异常充电工况的同版可核结果；不能让用户自行试用验证。",
      "乙后续若有适用批次整改和复测证据才可重新评估，当前仍排除。",
      "三款长期持有成本、研发和实际用工均未知；甲丙总体可靠性仍缺足够持续稳定性依据，不宣称综合质量优胜。",
      "价格、库存和交易条件仅对应2026-10-28虚构记录；未领优惠、未复现结算，本轮没有外部更新。"
    ]
  }
}
