{
  "fixture_id": "F2",
  "run_id": "F2-B",
  "input_hash": "d9b4632b54bbd83589ee3a80b73a95ddcb264d3c425dbacb82a67ca94b435eb8",
  "skill_hash": "8f2bedc424d626d7e2c7ea16e27410b4d41802895933afb0ed64de66f26a7fbc",
  "execution": {
    "date": "2026-10-29（Asia/Hong_Kong；实际执行日期，题设证据日期为2026-10-28）",
    "context": "新建独立子代理上下文；仅按本题限定材料进行盲评，未读取其他题、结果、oracle、tests/README或历史。",
    "configuration": "继承默认配置，未显式覆盖模型；后端模型标识及实际采样参数未暴露，均未知。",
    "observed_scope": "仅F2：读取think-like-me、冻结购物技能及其scoring/purchase-decision规则、F2原始材料和结果schema；未联网。仅写并读回stage/tests/runs/r1/F2-B.json。"
  },
  "anchors": {
    "scale": "各维度0—10整数分，原权重35/20/15/10/10/5/5。先按需求及可比指标确定锚点，再评分；未知为null/N/A，不作0或5分。安全独立门槛，不加权。",
    "quality": {
      "0": "已证实核心功能严重失效或参数真实性严重失守，使日常用途不能成立。",
      "5": "基本可用，但核心性能或真实性有明显且持续的取舍。",
      "10": "同口径已证明显著性能和耐久优势，且标示一致。",
      "indicators": "防泼水、拉链开合、缝线抗拉与标签实测一致性；相同试验口径比较，未知持有寿命不冒充已测。",
      "intermediate": "三项已测功能一致满足本次通勤、但无显著优胜证据的共同基础为8；重复复测确认的25%厚度高标损害真实性，下调2分至6，实际功能仍保留。"
    },
    "fit": {
      "0": "不能容纳A4或存在明确通勤硬冲突。",
      "5": "基本装得下，但有影响日常通勤的重要尺寸或负担取舍。",
      "10": "完整适配并有可比证据证明明显额外便利。",
      "indicators": "A4容量、宽度及轻量通勤，不把相同功能试验再奖励一次。",
      "intermediate": "尺寸及轻量通勤均满足且无关键未知为8；两款相同，不制造适配差异。"
    },
    "value": {
      "0": "已核必要支出超过80预算或无对应使用价值。",
      "5": "在预算内但相对有效功能有重要价格取舍。",
      "10": "可比同用途商品中已证明显著成本优势且无相应负担。",
      "indicators": "同版公开价加已知必要费用、预算占用及已核有效用途；不称已复现结算价。",
      "intermediate": "49与52、已知配送费0均明显低于80且功能相当，给共同8分；3的公开报价差不足以据此判显著价值优势，另保留其真实价差。售后及标签事件不再在此重复扣。"
    },
    "long_term_cost": {
      "0": "已核持有成本形成严重负担。",
      "5": "可接受但有重要费用取舍。",
      "10": "完整同口径持有期费用证明显著优势。",
      "unavailable": "材料不足以评完整维度时N/A；不以购入价补替长期成本。"
    },
    "after_sales": {
      "0": "已证实服务普遍或持续无法获得，实际救济失效。",
      "5": "基本服务可用，但存在实质履约障碍。",
      "10": "可比证据支持持续及时执行、救济有效且明显优胜。",
      "indicators": "退货和保修条件及其实际履行；承诺与执行分开。",
      "intermediate": "清晰7日未使用退货和12个月保修承诺的基础为6；符合条件仍明确拒绝且未补救，扣3至3。实际按期完成符合条件退换的记录支持8；不把样本数量本身当表现分。"
    },
    "rd_marketing": {
      "0": "独立证据确认重大宣传失实或成果冒用。",
      "5": "可核成果及宣传基本对应但有重要取舍。",
      "10": "可比证据支持显著研发成果及兑现优势。",
      "unavailable": "研发和独立营销事实均不足时N/A；同一标签事件不重新命名后重复扣分。"
    },
    "labor": {
      "0": "可归属实际用工存在严重侵害且未补救。",
      "5": "基本待遇落实但有重要取舍。",
      "10": "可比实际工时、待遇和补救证据支持显著优势。",
      "unavailable": "没有可评价实际用工证据时N/A，不因未发现争议给分。"
    },
    "recommendation": {
      "5": "基本适配但存在重要且影响选择的已核取舍。",
      "8": "符合主要需求，按并列购买状态可优先考虑。",
      "9-10": "需显著比较优势证据；不是部分分归一化。"
    }
  },
  "candidates": [
    {
      "candidate_id": "F2-A",
      "dimensions": {
        "quality": {
          "score": 6,
          "weight": 35,
          "evidence_ids": [
            "F2-A-1",
            "F2-COMMON-1"
          ],
          "reason": "相同防泼水、开合及抗拉表现支持基础8；复测确认厚度标示偏高，真实性扣2至6，不推断另有耐久劣势。",
          "evidence_state": "同版独立实测；标示不符已证实"
        },
        "fit": {
          "score": 8,
          "weight": 20,
          "evidence_ids": [
            "F2-COMMON-1"
          ],
          "reason": "A4与轻量通勤适配已明确，达到无重大通勤取舍的8分档；没有额外便利优胜依据。",
          "evidence_state": "独立样品验收；适配已核"
        },
        "value": {
          "score": 8,
          "weight": 15,
          "evidence_ids": [
            "F2-A-2"
          ],
          "reason": "公开价49、已知必要配送费0，预算有余；相对52仅便宜3，保留共同8分，不冒称结算价或折入优惠。",
          "evidence_state": "当前同版公开交易价；未结算"
        },
        "long_term_cost": {
          "score": null,
          "weight": 10,
          "evidence_ids": [
            "F2-COMMON-2"
          ],
          "reason": "无法形成完整持有期成本判断，N/A；购入价不补入本项。",
          "evidence_state": "资料不足，N/A"
        },
        "after_sales": {
          "score": 3,
          "weight": 10,
          "evidence_ids": [
            "F2-A-2",
            "F2-A-3"
          ],
          "reason": "清晰承诺支持基础6；有效退货请求被无约定理由拒绝且尚无退款，实际执行损害核心选择条件，扣3至3。",
          "evidence_state": "承诺及可归属完整订单、沟通记录；违约执行事实已核"
        },
        "rd_marketing": {
          "score": null,
          "weight": 5,
          "evidence_ids": [
            "F2-A-1",
            "F2-COMMON-2"
          ],
          "reason": "无足够研发或独立营销行为依据，N/A；厚度标签事件已归质量，不改称宣传失实再扣。",
          "evidence_state": "资料不足；无新增独立营销负面"
        },
        "labor": {
          "score": null,
          "weight": 5,
          "evidence_ids": [
            "F2-COMMON-2"
          ],
          "reason": "实际工时、待遇及补救均无法评价，N/A。",
          "evidence_state": "资料不足，N/A"
        }
      },
      "safety": [
        {
          "item": "T-边缘防护",
          "state": "通过",
          "evidence_ids": [
            "F2-COMMON-1"
          ],
          "reason": "同版相关条件及归属签发已由题设核实；限本次通勤用途。"
        },
        {
          "item": "T-接触材料",
          "state": "通过",
          "evidence_ids": [
            "F2-COMMON-1"
          ],
          "reason": "同版相关条件已核通过；厚度标示事件没有独立材料安全不合格证据。"
        }
      ],
      "purchase_status": "仅适合优先核验",
      "status_reason": "版本、A4通勤、安全、预算和配送有依据；但用户重视售后实际执行，已核有效退货被拒且救济未闭合，服务能否落实是决定性缺口。需核卖家补救及可执行退货路径后再升级；这不构成安全排除。",
      "negative_events": [
        {
          "event_id": "E-厚度",
          "evidence_ids": [
            "F2-A-1"
          ],
          "primary_dimension": "quality",
          "before": 8,
          "after": 6,
          "reason": "同条件实测支持基础8，稳定复测仍比标示低25%，真实性受损扣2；原权重影响为35×(6−8)/10=−7。",
          "other_consequences": [
            "没有区别于标签的独立营销误导行为，不扣研发营销。",
            "已测防泼水、开合及抗拉相同，不能推断另有性能下降；评论转述不另立事件。"
          ]
        },
        {
          "event_id": "E-退货",
          "evidence_ids": [
            "F2-A-2",
            "F2-A-3"
          ],
          "primary_dimension": "after_sales",
          "before": 6,
          "after": 3,
          "reason": "承诺基础6下，明确符合条件仍拒绝且未退款，使服务执行出现实质障碍；比已测功能仍可用的标签事件影响更直接，扣3。原权重影响10×(3−6)/10=−3。",
          "other_consequences": [
            "与厚度事件的消费者及样品独立，独立计入售后，不回扣质量。",
            "未补救使服务落实成为购买状态的决定性待核项；不是新增加权罚分，评论转述不重复计。"
          ]
        }
      ],
      "aggregate": {
        "kind": "partial",
        "numerator": 52,
        "denominator": 80,
        "included_dimensions": [
          "quality",
          "fit",
          "value",
          "after_sales"
        ],
        "formula": "35×6/10＋20×8/10＋15×8/10＋10×3/10＝21＋16＋12＋3＝52/80；保留原权重，长期成本10、研发营销5、劳工5为N/A，不折算成100或10分总分。"
      },
      "recommendation": {
        "score": 5,
        "nature": "主观暂定推荐分；仅表达核验价值，非部分分换算",
        "reason": "用途适配且公开价较低，但标签真实性和售后拒绝执行构成重要取舍，当前仅适合优先核验。",
        "change_conditions": [
          "退货事件获得可核补救，并落实实际可执行的服务路径。",
          "厚度标示纠正及同版一致性得到后续证据支持。"
        ]
      }
    },
    {
      "candidate_id": "F2-B",
      "dimensions": {
        "quality": {
          "score": 8,
          "weight": 35,
          "evidence_ids": [
            "F2-B-1",
            "F2-COMMON-1"
          ],
          "reason": "相同三项功能表现支持共同基础8，标签与实测一致；未证明优于同款实测功能，不能给显著优胜分。",
          "evidence_state": "同版独立检测；标示一致"
        },
        "fit": {
          "score": 8,
          "weight": 20,
          "evidence_ids": [
            "F2-COMMON-1"
          ],
          "reason": "与袋甲相同的A4和轻量通勤适配为8，没有可据此制造的适配差异。",
          "evidence_state": "独立样品验收；适配已核"
        },
        "value": {
          "score": 8,
          "weight": 15,
          "evidence_ids": [
            "F2-B-2"
          ],
          "reason": "同版公开价52、配送费0，预算内且用途相当；比袋甲多3，未达到本尺度下的重要价格取舍，保留共同8分。",
          "evidence_state": "当前同版公开交易价；未声称复现结算"
        },
        "long_term_cost": {
          "score": null,
          "weight": 10,
          "evidence_ids": [
            "F2-COMMON-2"
          ],
          "reason": "完整长期持有成本无法评价，N/A。",
          "evidence_state": "资料不足，N/A"
        },
        "after_sales": {
          "score": 8,
          "weight": 10,
          "evidence_ids": [
            "F2-B-2"
          ],
          "reason": "服务条件明确，已归属订单显示符合条件退换按期完成，支持执行良好的8分档；小样本不能证明将来无纠纷。",
          "evidence_state": "公开服务条件及完整可归属履行记录"
        },
        "rd_marketing": {
          "score": null,
          "weight": 5,
          "evidence_ids": [
            "F2-COMMON-2"
          ],
          "reason": "研发成果与企业营销状况无足够评价依据，N/A，不用标签一致推断研发优势。",
          "evidence_state": "资料不足，N/A"
        },
        "labor": {
          "score": null,
          "weight": 5,
          "evidence_ids": [
            "F2-COMMON-2"
          ],
          "reason": "实际劳工状况无足够依据，N/A，不按未发现负面加分。",
          "evidence_state": "资料不足，N/A"
        }
      },
      "safety": [
        {
          "item": "T-边缘防护",
          "state": "通过",
          "evidence_ids": [
            "F2-COMMON-1"
          ],
          "reason": "同版适用条件及资料归属签发已核，限题设通勤用途。"
        },
        {
          "item": "T-接触材料",
          "state": "通过",
          "evidence_ids": [
            "F2-COMMON-1"
          ],
          "reason": "同版适用条件已核通过，无本题相关安全缺口。"
        }
      ],
      "purchase_status": "可进入购买决策",
      "status_reason": "准确版本、核心需求、安全、公开报价52及配送费0、现货和服务执行均足以支持市场M内本次决策；报价仍是2026-10-28公开价，最终库存和结算可能变化。",
      "negative_events": [],
      "aggregate": {
        "kind": "partial",
        "numerator": 64,
        "denominator": 80,
        "included_dimensions": [
          "quality",
          "fit",
          "value",
          "after_sales"
        ],
        "formula": "35×8/10＋20×8/10＋15×8/10＋10×8/10＝28＋16＋12＋8＝64/80；另20权重N/A，保留原分母80，不称完整综合分。"
      },
      "recommendation": {
        "score": 8,
        "nature": "主观推荐分；非部分分换算",
        "reason": "通勤功能相当，标示一致且已有按期服务执行，增加3公开支出可接受；购买状态允许优先考虑。",
        "change_conditions": [
          "出现可归属服务不履行或核心功能反证时重评。",
          "价格、库存、必要费用或版本变化时重新确认预算与可购性。"
        ]
      }
    }
  ],
  "comparison": {
    "order_type": "conditional",
    "candidate_order": [
      "F2-B",
      "F2-A"
    ],
    "reason": "先按行动状态：袋乙可进入购买决策，袋甲仅适合优先核验。共同四维原权重80范围内为64/80对52/80，差异来自标签真实性与售后执行；功能本身没有已核优劣，袋甲公开价便宜3。该顺序仅限本次通勤、预算及重视服务执行的条件。",
    "unresolved": [
      "两款长期持有成本、研发营销及劳工未知，不能宣称全七项综合最优。",
      "袋甲退货争议未补救，平台处理待定；若服务落实与标签纠正有新证据，状态和顺序需复核。",
      "袋乙履行样本有限，不代表普遍或未来永无纠纷；两款报价均未复现结算。"
    ]
  }
}
