{
  "fixture_id": "F1",
  "run_id": "F1-C",
  "input_hash": "91270795264f6bc26077ad4cd6198bb802a9908b13650c57c097de3b71b288e4",
  "skill_hash": "e5cc1f9a5a61b93c025ff8d8109cd3747031695061e89de762146820cd4d7662",
  "execution": {
    "date": "2026-10-30",
    "context": "新上下文独立评分；仅读取本题固定材料、共享口径、指定技能与必要规则，未读其他题、结果或oracle。",
    "configuration": "继承默认配置，无显式模型覆盖；精确后端与采样参数未知，未暴露。",
    "observed_scope": "仅本题虚构固定材料及共享事后标定口径；未联网、未检测客户端触发，未验证现实商品。",
    "calibration_hash": "1f87b8501fa2770b7068ccbaa2e66f65561bdaba3237597027e3372dc1836e01",
    "skill_hash_scope": "整个运行技能目录的manifest哈希，按任务给定值记录，并非SKILL.md单文件哈希。",
    "evidence_date": "2026-10-28",
    "review": "同代理按输入记录、门槛、去重及算式反向复核；未另派代理。"
  },
  "anchors": {
    "source": "F1共享口径卡r2-calibration-1；先声明以下范围，再按原始记录独立归属与计算。",
    "weights": {
      "quality": 35,
      "fit": 20,
      "value": 15,
      "long_term_cost": 10,
      "after_sales": 10,
      "rd_marketing": 5,
      "labor": 5
    },
    "quality": {
      "0": "日常3kg严重失效，基本取放不成立。",
      "5": "基本可用，但较早、持续或明显的日常卡涩/变形形成重要取舍。",
      "8": "同版3kg至少5000次保持功能且后段仍可取放的够用基础。",
      "10": "较够用水平有明确可比的显著耐久优势，且标示一致。",
      "scope": "3kg循环功能、顺畅性及负载标示与升载结果一致性；安全单列。",
      "adjustments": "晚期少量卡涩且仍可取放下调1；高于日常负载的标示不符另下调1，只归质量各一次。",
      "na": "仅参数与安全验收，完全缺循环或长期耐久核心依据时，整体质量N/A。"
    },
    "fit": {
      "0": "无法完成A4用途或超过限宽。",
      "5": "可用但空间或装取存在明显负担。",
      "8": "A4及限宽明确满足，有通常余量，无额外便利依据；厂商参数可支持适配推断。",
      "10": "有相对够用水平明确的额外操作或空间收益。",
      "scope": "仅A4装取、占宽和物理用途，不重复计耐久或标示真实性。"
    },
    "value": {
      "0": "必要支出与基本效用明显不匹配或无法满足预算。",
      "5": "基本效用成立，公开必要支出占预算90%至100%。",
      "7": "占预算大于80%且小于90%。",
      "8": "占预算60%至80%，含端点。",
      "9": "基本效用可比且占预算低于60%。",
      "10": "另有同功能同交易层次的充分可比证据证明突出优势。",
      "scope": "同版公开价与已知必要费用相对100预算及已核基础功能，不评未知寿命或称结算价、最低价。",
      "na": "功能或必要费用不足以支持限定判断时N/A；小额价差同档保留金额。"
    },
    "long_term_cost": {
      "0": "有据表明持有负担严重不适用。",
      "5": "有据表明基本可承受但有重要成本取舍。",
      "10": "有可比实际成本证明显著持有收益。",
      "scope": "实际耗材、维修及持有期支出。",
      "na": "本题核心成本依据不足，不启用数值档位，N/A；保修与低购价不代表零成本。"
    },
    "after_sales": {
      "0": "已核无可用基本补救，或严重拒绝履行且无有效补救。",
      "5": "7日未使用退货与12个月质量保修的基础条款组合。",
      "10": "实际执行与维修支持证明显著高于基础保障。",
      "scope": "仅已核公开退货与保修条款；执行、供件和维修分别未知。",
      "na": "条款足以评有限范围时给分，不把执行未知当中位或自动整维N/A。"
    },
    "rd_marketing": {
      "0": "独立证据表明严重相关不足或误导。",
      "5": "足以支持基本成果与兑现但存在重要取舍。",
      "10": "可比证据支持显著成果与兑现优势。",
      "scope": "可归属成果及独立宣传兑现。",
      "na": "本题整体成果依据不足，不启用数值档位，N/A；已归质量事件不重复扣。"
    },
    "labor": {
      "0": "可靠可归属证据表明严重实际不足。",
      "5": "有据表明基本保障成立但存在重要取舍。",
      "10": "可比实际执行证据支持显著优势。",
      "scope": "实际主体工时、待遇及补救。",
      "na": "本题没有实际用工材料，不启用数值档位，N/A。"
    },
    "calculation": "weight×score/10；仅累加可评维度并保留原权重分母，不归一化，不混排不同项目集合。",
    "status": "安全不满足直接排除；核心耐久实质缺证仅优先核验；已知非门槛取舍不自动降为待核。"
  },
  "candidates": [
    {
      "candidate_id": "F1-A",
      "version": "架甲2026标准版",
      "dimensions": {
        "quality": {
          "score": 6,
          "weight": 35,
          "evidence_ids": [
            "F1-A-1"
          ],
          "reason": "3kg下10件均完成5000次取放，基础8；后段2件卡涩仍能取放减1，3.8kg即明显变形与5kg标示不符再减1。",
          "evidence_state": "独立同版耐久及升载记录；两项已知负面不外推为3kg安全失效。"
        },
        "fit": {
          "score": 8,
          "weight": 20,
          "evidence_ids": [
            "F1-A-1"
          ],
          "reason": "宽27cm小于30cm，A4装取正常，满足物理用途且有通常余量。",
          "evidence_state": "独立同版记录支持适配；无显著额外便利证据。"
        },
        "value": {
          "score": 8,
          "weight": 15,
          "evidence_ids": [
            "F1-A-1",
            "F1-A-2"
          ],
          "reason": "公开价79加已知配送费0，占100预算79%；基础功能成立，按60%至80%档给8。",
          "evidence_state": "同版公开报价及必要费用，不是已复现结算价或市场最低价。"
        },
        "long_term_cost": {
          "score": null,
          "weight": 10,
          "evidence_ids": [
            "F1-COMMON-2"
          ],
          "reason": "缺足够耗材与维修实际成本，不能从保修或现价推定持有成本。",
          "evidence_state": "核心成本依据不足，N/A。"
        },
        "after_sales": {
          "score": 5,
          "weight": 10,
          "evidence_ids": [
            "F1-A-2",
            "F1-COMMON-2"
          ],
          "reason": "明确7日未使用退货与12个月保修，符合基础条款5分；执行样本仍未知。",
          "evidence_state": "公开卖家条款有限范围评分；实际执行、供件及维修未核。"
        },
        "rd_marketing": {
          "score": null,
          "weight": 5,
          "evidence_ids": [
            "F1-COMMON-2",
            "F1-A-1"
          ],
          "reason": "没有足够研发成果与整体依据；承载标示问题已归质量，不在此重复扣。",
          "evidence_state": "整体依据不足，N/A。"
        },
        "labor": {
          "score": null,
          "weight": 5,
          "evidence_ids": [
            "F1-COMMON-2"
          ],
          "reason": "无实际用工资料，不能以未见争议给分。",
          "evidence_state": "资料不足，N/A。"
        }
      },
      "safety": [
        {
          "item": "T-架体稳定",
          "state": "通过",
          "evidence_ids": [
            "F1-COMMON-1"
          ],
          "reason": "题设独立验收已核同版对应，3kg规定工况无倾覆；仅属虚构测试要求。"
        },
        {
          "item": "T-边缘防护",
          "state": "通过",
          "evidence_ids": [
            "F1-COMMON-1"
          ],
          "reason": "同版3kg规定工况无锐边暴露，题设明确没有其他未说明的关键安全项目。"
        }
      ],
      "purchase_status": "可进入购买决策",
      "status_reason": "A4、27cm及79+0≤100满足硬条件，3kg日常耐久及全部关键安全有据；指定卖家现货、全市场配送和售后条款齐备。接受后段卡涩取舍并限于日常3kg，不依赖5kg标示；未结算不机械降级。",
      "negative_events": [
        {
          "event_id": "F1-A-晚期卡涩",
          "evidence_ids": [
            "F1-A-1"
          ],
          "primary_dimension": "quality",
          "before": 8,
          "after": 7,
          "reason": "5001至10000次间2/10件卡涩但仍可取放，按轻度后段问题减1，加权影响-3.5。",
          "other_consequences": [
            "披露长周期顺畅性取舍；不重复扣适配、口碑或长期成本。"
          ]
        },
        {
          "event_id": "F1-A-承载标示不符",
          "evidence_ids": [
            "F1-A-1"
          ],
          "primary_dimension": "quality",
          "before": 7,
          "after": 6,
          "reason": "首次明显变形3.8kg与最大5kg标示不一致，真实性减1，加权影响-3.5；高于本次3kg用途。",
          "other_consequences": [
            "限制依赖5kg宣传；不重复扣研发营销或将其改判为3kg安全不通过。"
          ]
        }
      ],
      "aggregate": {
        "kind": "partial",
        "numerator": 54,
        "denominator": 80,
        "included_dimensions": [
          "quality",
          "fit",
          "value",
          "after_sales"
        ],
        "formula": "35×6/10+20×8/10+15×8/10+10×5/10=21+16+12+5=54；原权重35+20+15+10=80，部分分54/80。"
      }
    },
    {
      "candidate_id": "F1-B",
      "version": "架乙2026标准版",
      "dimensions": {
        "quality": {
          "score": null,
          "weight": 35,
          "evidence_ids": [
            "F1-B-1",
            "F1-COMMON-1"
          ],
          "reason": "仅厂商参数与安全验收，完全缺取放循环、长期卡涩或同版耐久失效数据，整体质量N/A。",
          "evidence_state": "核心耐久依据不足；安全通过保留，不把未发现缺点当表现优良。"
        },
        "fit": {
          "score": 8,
          "weight": 20,
          "evidence_ids": [
            "F1-B-1"
          ],
          "reason": "厂商参数载明宽27cm且可放A4，支持符合物理用途的适配推断。",
          "evidence_state": "厂商参数支持的适配推断，未冒充独立耐久实测。"
        },
        "value": {
          "score": 8,
          "weight": 15,
          "evidence_ids": [
            "F1-B-1",
            "F1-B-2",
            "F1-COMMON-1"
          ],
          "reason": "公开价75加配送费0，占预算75%，基础A4用途及3kg安全有据，按60%至80%档给8。",
          "evidence_state": "限定公开报价下的基础功能价值，不包含未知寿命或结算优惠。"
        },
        "long_term_cost": {
          "score": null,
          "weight": 10,
          "evidence_ids": [
            "F1-COMMON-2"
          ],
          "reason": "无足够实际耗材和维修成本，不能推定零成本。",
          "evidence_state": "核心成本依据不足，N/A。"
        },
        "after_sales": {
          "score": 5,
          "weight": 10,
          "evidence_ids": [
            "F1-B-2",
            "F1-COMMON-2"
          ],
          "reason": "同为7日未使用退货与12个月保修的基础条款，给5；实际执行未知。",
          "evidence_state": "仅公开卖家条款评分，执行、供件与维修未核。"
        },
        "rd_marketing": {
          "score": null,
          "weight": 5,
          "evidence_ids": [
            "F1-COMMON-2"
          ],
          "reason": "研发成果与整体宣传兑现依据不足，未知不填分。",
          "evidence_state": "整体依据不足，N/A。"
        },
        "labor": {
          "score": null,
          "weight": 5,
          "evidence_ids": [
            "F1-COMMON-2"
          ],
          "reason": "无实际用工资料，未检出问题不能支持福利分。",
          "evidence_state": "资料不足，N/A。"
        }
      },
      "safety": [
        {
          "item": "T-架体稳定",
          "state": "通过",
          "evidence_ids": [
            "F1-COMMON-1"
          ],
          "reason": "题设核实同版样品和签发对应，3kg规定工况无倾覆；不替代循环耐久依据。"
        },
        {
          "item": "T-边缘防护",
          "state": "通过",
          "evidence_ids": [
            "F1-COMMON-1"
          ],
          "reason": "同版3kg规定工况无锐边暴露，题设已覆盖全部相关关键安全项目。"
        }
      ],
      "purchase_status": "仅适合优先核验",
      "status_reason": "硬条件、全部关键安全、75+0预算及现货配送售后均有据；但用户核心优先项为耐久，完全没有日常循环或长期耐久依据，须补同版3kg循环或可信长期使用材料后再判断。",
      "negative_events": [],
      "aggregate": {
        "kind": "partial",
        "numerator": 33,
        "denominator": 45,
        "included_dimensions": [
          "fit",
          "value",
          "after_sales"
        ],
        "formula": "20×8/10+15×8/10+10×5/10=16+12+5=33；原权重20+15+10=45，部分分33/45。"
      }
    }
  ],
  "comparison": {
    "order_type": "conditional",
    "candidate_order": [
      "F1-A",
      "F1-B"
    ],
    "reason": "以本次3kg用途、耐久优先且接受甲后段卡涩为条件，甲先进入购买决策，乙先核耐久；54/80与33/45项目不同，不能据此混排。共同可评适配、价值、售后均为33/45；乙便宜4测试元但不证明耐久更好。",
    "unresolved": [
      "乙同版日常3kg循环及长期耐久为决定性缺口。",
      "两款长期成本、研发成果和实际用工未知；售后执行、供件及维修未知。",
      "所有结论仅限2026-10-28题设虚构材料；未执行领取优惠或结算，无现实商品验证。"
    ]
  }
}
